{
  "$schema": "./maps.schema.json",
  "version": 1,
  "mapId": "crystal-caverns",
  "tileSize": 64,
  "size": {
    "columns": 54,
    "rows": 54
  },
  "layers": [
    {
      "id": "ground",
      "encoding": "legend-chars-v1",
      "legend": {
        "c": "cavern-floor",
        "r": "crystal-floor",
        "w": "deep-water"
      },
      "rows": [
        "cccccccccccccccccccccccccccccccccccccccccccccccccccccc",
        "cccccccccccccccccccccccccccccccccccccccccccccccccccccc",
        "cccccccccccccccccccccccccccccccccccccccccccccccccccccc",
        "cccccccccccccccccccccccccccccccccccccccccccccccccccccc",
        "cccccccccccccccccccccccccccccccccccccccccccccccccccccc",
        "cccccccccccccccccccccccccccccccccccccccccccccccccccccc",
        "cccccccccrrrcrcrccrccccccccccccrccrcrccrrrrcrcrccccccc",
        "cccccccrrrcrcrrccrccrccccccccccccrrccrrrcrcccccccccccc",
        "ccccccccrcrrrcccrrcrrccccccccccrcrcccccrccrrrcrccccccc",
        "cccccccrrccrccrccccrccccccccccccrccrccrccrrcrccccccccc",
        "ccccccrcrrcrcrrrcrccccccccccccrcrrcrrrcrcrcrrccccccccc",
        "cccccccrcrrrrrcrcrccrcrcccccccccrrrrccwrrrcccccccccccc",
        "ccccccrrrwccrrrrccrcccccrcrccrccrccwrrcrrrrrrcrccccccc",
        "ccccccrcrrrwrrwwwrrrcccccccrrrcrrcrwwrwwrrcrrccrcccccc",
        "ccccccrwrrrwwrrrwccrcrccccccrccrccrrrwrrwrrrrcrrcccccc",
        "ccccccrrwrrrrwrrwrrcrcccccccrrcccrrrrrrrrrwrrrcccccccc",
        "cccccccrwrwrrwrrrcrrcccrrcrccrcwccrrcwwrwwrrcccccccccc",
        "cccccccrrwwwrrwwwrcrcrcrcccrrcrcccwwrrwwwrrrccrccccccc",
        "cccccccrwwcwrrcrrcccccccccccwrcrccrwwrwrrwrcccrccccccc",
        "ccccccrwrwrwwcwwrrrccrcccccccrrrccwrwwwrwcrrcccrcccccc",
        "ccccccrcrcwwrrwrrrccccrcccrrccccrrrrrwwcrwcrrccccccccc",
        "cccccccrrrcrrrrwrcrrccrccccccrcwrcrrwwrrrwrcrrcccccccc",
        "ccccccccrrcrcrwrrcccccccccrccccrrrwcrrwccrrccccccccccc",
        "ccccccrrcrrwrwrrrrrccccrccccccccrrcrwrcrcrrcrccccccccc",
        "ccccccrrrrcrwrrcccrrrccccccccccrccccrcrccccrrccccccccc",
        "ccccccccrrcrrrcccccrcccccccrccccccrcccccrcrrcrcccccccc",
        "cccccccrrrrrrrrcrrcrcrcccccccrcccrcrrrrcccrccccccccccc",
        "ccccccrrccccrrcccccrrcccccccccrccrcccccrcrcccccccccccc",
        "cccccccrrrrrrccrccrccccccccccccccrrrrrccrrcccrcccccccc",
        "cccccccccrrrccccccrccrcccccccccrrcrrrrrrcrcrccrccccccc",
        "cccccccrrcrrrrccccrccccccccrccccrccrcrcrrcrccccccccccc",
        "ccccccrccrrrrcrrrccrrcrccccrrccrrrrcrrrccccrcrcccccccc",
        "ccccccrrrrrrrrwrcrrrccccrrccrcrrccrwwrrrrcrrcrrccccccc",
        "cccccccrrcrrwcwccrccccccrrrcrcrwccwrrrrcrrrccrcrcccccc",
        "ccccccrrrcrwwrrrwrcccrccrcrcrrcrrrwwwrrrwwcrrrcrcccccc",
        "ccccccwwwwwrrrrrrrrcccrccccccrccrccwrwrwwwrrrcrccccccc",
        "ccccccrwcrrwwrwwrrrwccccrcccrrccccrwwwwwrrccwccccccccc",
        "ccccccrwwrrwrrrrwwwccrrccrcrcwccwwwrrwwrwrrwrrcrcccccc",
        "cccccccrwrrrrrwwrccrccrccccccccrrcrrwrrrwrrwrcrccccccc",
        "cccccccwwwrrwcrwrrcrccccccrcccccccrrrrrwrrrrcrcccccccc",
        "ccccccrwrrrwrwwrcrcccccccrccccccwwrwwwrwwrccrcrccccccc",
        "ccccccrcwrrrrwrwrccrcccccccccrccrcccrrwrrrccrccccccccc",
        "ccccccrrccwwrrrrrrccccccrcccrrrrccrrwcrrwrcrcccccccccc",
        "ccccccrcrwrrrccrcrccrccccccccrrrrrrrrwrrrcrrcccccccccc",
        "cccccccrrcccrrrrcrcrrccccccccccccrcrcrcrrrcccccccccccc",
        "ccccccrcrrcrrccrcrcccccccccccccrcrcrcrcccccccccccccccc",
        "ccccccccrcrrcrrccccrccccccccccccrrrrrcrcrccrcccccccccc",
        "cccccccccrccrcccrcccrcccccccccrccccrccrrcrcrcrcccccccc",
        "cccccccccccccccccccccccccccccccccccccccccccccccccccccc",
        "cccccccccccccccccccccccccccccccccccccccccccccccccccccc",
        "cccccccccccccccccccccccccccccccccccccccccccccccccccccc",
        "cccccccccccccccccccccccccccccccccccccccccccccccccccccc",
        "cccccccccccccccccccccccccccccccccccccccccccccccccccccc",
        "cccccccccccccccccccccccccccccccccccccccccccccccccccccc"
      ]
    }
  ],
  "objects": [],
  "player": {
    "spawn": {
      "x": 1728,
      "y": 1728
    },
    "entries": {
      "west": {
        "x": 256,
        "y": 1728
      },
      "east": {
        "x": 3200,
        "y": 1728
      }
    }
  },
  "exits": [
    {
      "zone": {
        "x": 0,
        "y": 0,
        "w": 32,
        "h": 3456
      },
      "to": "gloop-forest",
      "entry": "east"
    }
  ],
  "spawns": {
    "enemies": [
      {
        "type": "worm-brawler",
        "weight": 30
      },
      {
        "type": "worm-swordsman",
        "weight": 40
      },
      {
        "type": "worm-archer",
        "weight": 30
      }
    ],
    "radius": {
      "min": 200,
      "max": 500
    },
    "intervalMs": 1500,
    "maxPopulation": 16,
    "safeZones": []
  },
  "enemySafeZones": [
    {
      "x": 896,
      "y": 1600,
      "w": 1664,
      "h": 192
    },
    {
      "x": 2560,
      "y": 1536,
      "w": 128,
      "h": 256
    }
  ]
}
