{
  "$schema": "./maps.schema.json",
  "version": 1,
  "mapId": "slime-home",
  "tileSize": 64,
  "size": {
    "columns": 14,
    "rows": 11
  },
  "layers": [
    {
      "id": "ground",
      "encoding": "legend-chars-v1",
      "legend": {
        "w": "wood-floor"
      },
      "rows": [
        "wwwwwwwwwwwwww",
        "wwwwwwwwwwwwww",
        "wwwwwwwwwwwwww",
        "wwwwwwwwwwwwww",
        "wwwwwwwwwwwwww",
        "wwwwwwwwwwwwww",
        "wwwwwwwwwwwwww",
        "wwwwwwwwwwwwww",
        "wwwwwwwwwwwwww",
        "wwwwwwwwwwwwww",
        "wwwwwwwwwwwwww"
      ]
    }
  ],
  "objects": [],
  "player": {
    "spawn": {
      "x": 448,
      "y": 624
    },
    "entries": {
      "south": {
        "x": 448,
        "y": 624
      }
    }
  }
}
